,Name,Brand,Price,Image_URL,Product_URL
0,Maya Petite Bridesmaid short sleeve maxi tulle dress with tonal delicate sequins in navy,Maya Petite,€137.99,images.asos-media.com/products/maya-petite-bridesmaid-short-sleeve-maxi-tulle-dress-with-tonal-delicate-sequins-in-navy/201395104-1-navy,maya-petite/maya-petite-bridesmaid-short-sleeve-maxi-tulle-dress-with-tonal-delicate-sequins-in-navy/prd/201395104#colourWayId-201395108
1,adidas Originals Gazelle Bold platform trainers in cream/green with gum sole,adidas Originals,€120.00,images.asos-media.com/products/adidas-originals-gazelle-bold-platform-trainers-in-cream-green-with-gum-sole/204837346-1-cream,adidas-originals/adidas-originals-gazelle-bold-platform-trainers-in-cream-green-with-gum-sole/prd/204837346#colourWayId-204837347
2,Vero Moda textured long sleeved top and maxi skirt co-ord in chocolate brown,Vero Moda,€87.98,images.asos-media.com/groups/vero-moda-textured-long-sleeved-top-and-maxi-skirt-co-ord-in-chocolate-brown/206149709-group-1,vero-moda/vero-moda-textured-long-sleeved-top-and-maxi-skirt-co-ord-in-chocolate-brown/grp/206149709
3,4th & Reckless Dianna lounge tracksuit in grey marl,4th & Reckless,€103.98,images.asos-media.com/groups/4th-reckless-dianna-lounge-tracksuit-in-grey-marl/206161792-group-1,4th-reckless/4th-reckless-dianna-lounge-tracksuit-in-grey-marl/grp/206161792#colourWayId-205599726
4,ASOS DESIGN halter crochet knit maxi beach dress in black,ASOS DESIGN,€49.99,images.asos-media.com/products/asos-design-halter-crochet-knit-maxi-beach-dress-in-black/205870366-1-black,asos-design/asos-design-halter-crochet-knit-maxi-beach-dress-in-black/prd/205870366#colourWayId-205870367
5,ASOS DESIGN off shoulder linen maxi dress with knot detail in chocolate,ASOS DESIGN,€39.99,images.asos-media.com/products/asos-design-off-shoulder-linen-maxi-dress-with-knot-detail-in-chocolate/205511821-1-chocolate,asos-design/asos-design-off-shoulder-linen-maxi-dress-with-knot-detail-in-chocolate/prd/205511821#colourWayId-205511822
6,ASOS DESIGN Petite mesh long sleeve dobby polka dot flock bodysuit in black,ASOS Petite,€32.99,images.asos-media.com/products/asos-design-petite-mesh-long-sleeve-dobby-polka-dot-flock-bodysuit-in-black/203915181-1-black,asos-petite/asos-design-petite-mesh-long-sleeve-dobby-polka-dot-flock-bodysuit-in-black/prd/203915181#colourWayId-203915182
7,ASOS DESIGN mesh bodysuit in chocolate,ASOS DESIGN,€22.99,images.asos-media.com/products/asos-design-mesh-bodysuit-in-chocolate/204971221-1-chocolate,asos-design/asos-design-mesh-bodysuit-in-chocolate/prd/204971221#colourWayId-204971225
8,ASOS DESIGN quilt lined harrington jacket in black,ASOS DESIGN,€59.99,images.asos-media.com/products/asos-design-quilt-lined-harrington-jacket-in-black/204668970-1-black,asos-design/asos-design-quilt-lined-harrington-jacket-in-black/prd/204668970#colourWayId-204668972
9,ASOS DESIGN brushed bomber jacket in charcoal,ASOS DESIGN,€74.99,images.asos-media.com/products/asos-design-brushed-bomber-jacket-in-charcoal/204874504-1-charcoal,asos-design/asos-design-brushed-bomber-jacket-in-charcoal/prd/204874504#colourWayId-204874515
10,Topshop Joni jeans in black,Topshop,€47.99,images.asos-media.com/products/topshop-joni-jeans-in-black/201857598-1-black,topshop/topshop-joni-jeans-in-black/prd/201857598#colourWayId-201857616
11,Topshop Jamie flare jeans in black,Topshop,€54.99,images.asos-media.com/products/topshop-jamie-flare-jeans-in-black/203038284-1-black,topshop/topshop-jamie-flare-jeans-in-black/prd/203038284#colourWayId-203038288
12,Nike Air Max 1 trainers in leopard print,Nike,€159.99,images.asos-media.com/products/nike-air-max-1-trainers-in-leopard-print/205298253-1-beige,nike/nike-air-max-1-trainers-in-leopard-print/prd/205298253#colourWayId-205298270
13,ellesse Panaro cupsole trainers in white and blue,ellesse,€94.99,images.asos-media.com/products/ellesse-panaro-cupsole-trainers-in-white-and-blue/205020164-1-white,ellesse/ellesse-panaro-cupsole-trainers-in-white-and-blue/prd/205020164#colourWayId-205020165
14,Topshop 80s clean short sleeve top in stone,Topshop,€39.99,images.asos-media.com/products/topshop-80s-clean-short-sleeve-top-in-stone/205806874-1-stone,topshop/topshop-80s-clean-short-sleeve-top-in-stone/prd/205806874#colourWayId-205806875
15,Topshop clean square neck long sleeve top in black,Topshop,€27.99,images.asos-media.com/products/topshop-clean-square-neck-long-sleeve-top-in-black/205618677-1-black,topshop/topshop-clean-square-neck-long-sleeve-top-in-black/prd/205618677#colourWayId-205618688
16,ASOS DESIGN button through waistcoat & maxi skirt in stone co-ord,ASOS DESIGN,€54.98,images.asos-media.com/groups/asos-design-button-through-waistcoat-maxi-skirt-in-stone-co-ord/206168821-group-1,asos-design/asos-design-button-through-waistcoat-maxi-skirt-in-stone-co-ord/grp/206168821
17,Candypants tie dye bikini in multi,Candypants,€48.98,images.asos-media.com/groups/candypants-tie-dye-bikini-in-multi/206182929-group-1,candypants/candypants-tie-dye-bikini-in-multi/grp/206182929
18,South Beach Curve zebra print oversized beach shirt in brown,South Beach Curve,€52.99,images.asos-media.com/products/south-beach-curve-zebra-print-oversized-beach-shirt-in-brown/205458705-1-brown,south-beach-curve/south-beach-curve-zebra-print-oversized-beach-shirt-in-brown/prd/205458705#colourWayId-205458714
19,South Beach oversized zebra print beach shirt co-ord in brown,South Beach,€52.99,images.asos-media.com/products/south-beach-oversized-zebra-print-beach-shirt-co-ord-in-brown/205458708-1-brown,south-beach/south-beach-zebra-print-beach-co-ord-in-brown/grp/206129734#colourWayId-205458715&productId-205458708
20,ONLY Emily high waist straight leg ankle jean in wash black,ONLY,€43.99,images.asos-media.com/products/only-emily-high-waist-straight-leg-ankle-jean-in-wash-black/205646310-1-blackdenim,only/only-emily-high-waist-straight-leg-ankle-jean-in-wash-black/prd/205646310#colourWayId-205646311
21,Topshop Editor jeans in bleach,Topshop,€64.99,images.asos-media.com/products/topshop-editor-jeans-in-bleach/205685208-1-bleach,topshop/topshop-editor-jeans-in-bleach/prd/205685208#colourWayId-205685210
22,Maya Maternity Bridesmaid long sleeve maxi tulle dress with tonal delicate sequin in muted blush,Maya Maternity,€145.99,images.asos-media.com/products/maya-maternity-bridesmaid-long-sleeve-maxi-tulle-dress-with-tonal-delicate-sequin-in-muted-blush/201394554-1-mutedblush,maya-maternity/maya-maternity-bridesmaid-long-sleeve-maxi-tulle-dress-with-tonal-delicate-sequin-in-muted-blush/prd/201394554#colourWayId-201394562
23,Maya Petite Bridesmaid short sleeve maxi tulle dress with tonal delicate sequins in muted blush,Maya Petite,€137.99,images.asos-media.com/products/maya-petite-bridesmaid-short-sleeve-maxi-tulle-dress-with-tonal-delicate-sequins-in-muted-blush/201395057-1-mutedblush,maya-petite/maya-petite-bridesmaid-short-sleeve-maxi-tulle-dress-with-tonal-delicate-sequins-in-muted-blush/prd/201395057#colourWayId-201395058
24,Maya Petite Bridesmaid halter neck midi tulle dress with tonal delicate sequins in muted blush,Maya Petite,€117.99,images.asos-media.com/products/maya-petite-bridesmaid-halter-neck-midi-tulle-dress-with-tonal-delicate-sequins-in-muted-blush/201395174-1-mutedblush,maya-petite/maya-petite-bridesmaid-halter-neck-midi-tulle-dress-with-tonal-delicate-sequins-in-muted-blush/prd/201395174#colourWayId-201395187
25,Maya Maternity Bridesmaid short sleeve maxi tulle dress with tonal delicate sequins in muted blush,Maya Maternity,€137.99,images.asos-media.com/products/maya-maternity-bridesmaid-short-sleeve-maxi-tulle-dress-with-tonal-delicate-sequins-in-muted-blush/201394617-1-mutedblush,maya-maternity/maya-maternity-bridesmaid-short-sleeve-maxi-tulle-dress-with-tonal-delicate-sequins-in-muted-blush/prd/201394617#colourWayId-201394642
26,Maya Petite Bridesmaid long sleeve maxi dress with delicate sequin in muted blush,Maya Petite,€145.99,images.asos-media.com/products/maya-petite-bridesmaid-long-sleeve-maxi-dress-with-delicate-sequin-in-muted-blush/201395004-1-mutedblush,maya-petite/maya-petite-bridesmaid-long-sleeve-maxi-dress-with-delicate-sequin-in-muted-blush/prd/201395004#colourWayId-201395012
27,Maya Petite Bridesmaid long sleeve maxi tulle dress with tonal delicate sequin in navy,Maya Petite,€145.99,images.asos-media.com/products/maya-petite-bridesmaid-long-sleeve-maxi-tulle-dress-with-tonal-delicate-sequin-in-navy/201395028-1-navy,maya-petite/maya-petite-bridesmaid-long-sleeve-maxi-tulle-dress-with-tonal-delicate-sequin-in-navy/prd/201395028#colourWayId-201395029
28,Maya Maternity Bridesmaid long sleeve maxi dress with delicate sequin in navy,Maya Maternity,€145.99,images.asos-media.com/products/maya-maternity-bridesmaid-long-sleeve-maxi-dress-with-delicate-sequin-in-navy/201394595-1-navy,maya-maternity/maya-maternity-bridesmaid-long-sleeve-maxi-dress-with-delicate-sequin-in-navy/prd/201394595#colourWayId-201394605
29,Maya Tall Bridesmaid short sleeve maxi tulle dress with tonal delicate sequins in sage green,Maya Tall,€137.99,images.asos-media.com/products/maya-tall-bridesmaid-short-sleeve-maxi-tulle-dress-with-tonal-delicate-sequins-in-sage-green/201395819-1-sagegreen,maya-tall/maya-tall-bridesmaid-short-sleeve-maxi-tulle-dress-with-tonal-delicate-sequins-in-sage-green/prd/201395819#colourWayId-201395820
30,Maya Petite Bridesmaid short sleeve maxi tulle dress with tonal delicate sequins in sage green,Maya Petite,€137.99,images.asos-media.com/products/maya-petite-bridesmaid-short-sleeve-maxi-tulle-dress-with-tonal-delicate-sequins-in-sage-green/201395163-1-sagegreen,maya-petite/maya-petite-bridesmaid-short-sleeve-maxi-tulle-dress-with-tonal-delicate-sequins-in-sage-green/prd/201395163#colourWayId-201395164
31,Maya Maternity Bridesmaid long sleeve maxi dress with delicate sequin in sage green,Maya Maternity,€145.99,images.asos-media.com/products/maya-maternity-bridesmaid-long-sleeve-maxi-dress-with-delicate-sequin-in-sage-green/201394640-1-sagegreen,maya-maternity/maya-maternity-bridesmaid-long-sleeve-maxi-dress-with-delicate-sequin-in-sage-green/prd/201394640#colourWayId-201394650
32,Maya Maternity Bridesmaid short sleeve maxi tulle dress with tonal delicate sequins in sage green,Maya Maternity,€137.99,images.asos-media.com/products/maya-maternity-bridesmaid-short-sleeve-maxi-tulle-dress-with-tonal-delicate-sequins-in-sage-green/201394665-1-sagegreen,maya-maternity/maya-maternity-bridesmaid-short-sleeve-maxi-tulle-dress-with-tonal-delicate-sequins-in-sage-green/prd/201394665#colourWayId-201394679
33,Moda Minx Amour gold crystal triangle bikini top in black,Moda Minx,€36.99,images.asos-media.com/products/moda-minx-amour-gold-crystal-triangle-bikini-top-in-black/202036565-1-black,moda-minx/moda-minx-amour-gold-crystal-triangle-bikini-top-in-black/prd/202036565#colourWayId-202036574
34,Moda Minx Amour gold crystal tie side brazilian bikini bottoms in black,Moda Minx,€36.99,images.asos-media.com/products/moda-minx-amour-gold-crystal-tie-side-brazilian-bikini-bottoms-in-black/202036696-1-black,moda-minx/moda-minx-amour-gold-crystal-tie-side-brazilian-bikini-bottoms-in-black/prd/202036696#colourWayId-202036703
35,TFNC Petite Bridesmaid flutter sleeve ruffle detail maxi dress in navy,TFNC Petite,€89.99,images.asos-media.com/products/tfnc-petite-bridesmaid-flutter-sleeve-ruffle-detail-maxi-dress-in-navy/202952012-1-navy,tfnc-petite/tfnc-petite-bridesmaid-flutter-sleeve-ruffle-detail-maxi-dress-in-navy/prd/202952012#colourWayId-202952013
36,TFNC Bridesmaid flutter sleeve ruffle detail maxi dress in sage,TFNC,€89.99,images.asos-media.com/products/tfnc-bridesmaid-flutter-sleeve-ruffle-detail-maxi-dress-in-sage/202617051-1-sagegreen,tfnc/tfnc-bridesmaid-flutter-sleeve-ruffle-detail-maxi-dress-in-sage/prd/202617051#colourWayId-202617052
37,TFNC Tall Bridesmaid flutter sleeve ruffle detail maxi dress in blush,TFNC Tall,€89.99,images.asos-media.com/products/tfnc-tall-bridesmaid-flutter-sleeve-ruffle-detail-maxi-dress-in-blush/202934371-1-blush,tfnc-tall/tfnc-tall-bridesmaid-flutter-sleeve-ruffle-detail-maxi-dress-in-blush/prd/202934371#colourWayId-202934372
38,TFNC Bridesmaid flutter sleeve ruffle detail maxi dress in navy,TFNC,€89.99,images.asos-media.com/products/tfnc-bridesmaid-flutter-sleeve-ruffle-detail-maxi-dress-in-navy/202950641-1-navy,tfnc/tfnc-bridesmaid-flutter-sleeve-ruffle-detail-maxi-dress-in-navy/prd/202950641#colourWayId-202950642
39,TFNC Petite Bridesmaid flutter sleeve ruffle detail maxi dress in blush,TFNC Petite,€89.99,images.asos-media.com/products/tfnc-petite-bridesmaid-flutter-sleeve-ruffle-detail-maxi-dress-in-blush/202953892-1-blush,tfnc-petite/tfnc-petite-bridesmaid-flutter-sleeve-ruffle-detail-maxi-dress-in-blush/prd/202953892#colourWayId-202953903
40,TFNC Tall Bridesmaid flutter sleeve ruffle detail maxi dress in sage,TFNC Tall,€89.99,images.asos-media.com/products/tfnc-tall-bridesmaid-flutter-sleeve-ruffle-detail-maxi-dress-in-sage/202934390-1-sage,tfnc-tall/tfnc-tall-bridesmaid-flutter-sleeve-ruffle-detail-maxi-dress-in-sage/prd/202934390#colourWayId-202934391
41,TFNC Petite Bridesmaid flutter sleeve ruffle detail maxi dress in sage,TFNC Petite,€89.99,images.asos-media.com/products/tfnc-petite-bridesmaid-flutter-sleeve-ruffle-detail-maxi-dress-in-sage/202952520-1-sage,tfnc-petite/tfnc-petite-bridesmaid-flutter-sleeve-ruffle-detail-maxi-dress-in-sage/prd/202952520#colourWayId-202952534
42,Maya Petite Bridesmaid long sleeve maxi dress with delicate sequin in sage green,Maya Petite,€145.99,images.asos-media.com/products/maya-petite-bridesmaid-long-sleeve-maxi-dress-with-delicate-sequin-in-sage-green/203657989-1-sagegreen,maya-petite/maya-petite-bridesmaid-long-sleeve-maxi-dress-with-delicate-sequin-in-sage-green/prd/203657989#colourWayId-203657990
43,ASOS DESIGN grown on neck mini dress with ruched sides in stone,ASOS DESIGN,€17.99,images.asos-media.com/products/asos-design-grown-on-neck-mini-dress-with-ruched-sides-in-stone/204400504-1-stone,asos-design/asos-design-grown-on-neck-mini-dress-with-ruched-sides-in-stone/prd/204400504#colourWayId-204400515
44,Anaya Petite Bridesmaid tulle one shoulder maxi dress in navy,Anaya Petite,€108.75,images.asos-media.com/products/anaya-petite-bridesmaid-tulle-one-shoulder-maxi-dress-in-navy/204533413-1-navy,anaya-petite/anaya-petite-bridesmaid-tulle-one-shoulder-maxi-dress-in-navy/prd/204533413#colourWayId-204533414
45,Anaya Petite Bridesmaid tulle one shoulder maxi dress in sage green,Anaya Petite,€108.75,images.asos-media.com/products/anaya-petite-bridesmaid-tulle-one-shoulder-maxi-dress-in-sage-green/204538068-1-sage,anaya-petite/anaya-petite-bridesmaid-tulle-one-shoulder-maxi-dress-in-sage-green/prd/204538068#colourWayId-204538070
46,ASOS DESIGN sleeveless maxi dress with buttons and tie detail in khaki,ASOS DESIGN,€35.99,images.asos-media.com/products/asos-design-sleeveless-maxi-dress-with-buttons-and-tie-detail-in-khaki/204069074-1-khaki,asos-design/asos-design-sleeveless-maxi-dress-with-buttons-and-tie-detail-in-khaki/prd/204069074#colourWayId-204069076
47,ASOS DESIGN ribbed scoop neck midi dress with dropped waist in black,ASOS DESIGN,€32.99,images.asos-media.com/products/asos-design-ribbed-scoop-neck-midi-dress-with-dropped-waist-in-black/204546586-1-black,asos-design/asos-design-ribbed-scoop-neck-midi-dress-with-dropped-waist-in-black/prd/204546586#colourWayId-204546597
48,Maya Tall Bridesmaid short sleeve maxi tulle dress with tonal delicate sequin in navy,Maya Tall,€137.99,images.asos-media.com/products/maya-tall-bridesmaid-short-sleeve-maxi-tulle-dress-with-tonal-delicate-sequin-in-navy/203657997-1-navy,maya-tall/maya-tall-bridesmaid-short-sleeve-maxi-tulle-dress-with-tonal-delicate-sequin-in-navy/prd/203657997#colourWayId-203657998
49,ASOS DESIGN Curve racer front ribbed midi tank dress in black,ASOS Curve,€17.99,images.asos-media.com/products/asos-design-curve-racer-front-ribbed-midi-tank-dress-in-black/204542528-1-black,asos-curve/asos-design-curve-racer-front-ribbed-midi-tank-dress-in-black/prd/204542528#colourWayId-204542536
50,ASOS DESIGN draped one shoulder maxi dress in sage,ASOS DESIGN,€37.99,images.asos-media.com/products/asos-design-draped-one-shoulder-maxi-dress-in-sage/204787375-1-sage,asos-design/asos-design-draped-one-shoulder-maxi-dress-in-sage/prd/204787375#colourWayId-204787378
51,Only denim midi skirt with front split in mid blue,ONLY,€50.99,images.asos-media.com/products/only-denim-midi-skirt-with-front-split-in-mid-blue/205143297-1-midblue,only/only-denim-midi-skirt-with-front-split-in-mid-blue/prd/205143297#colourWayId-205143298
52,ASOS DESIGN slash neck open back skort dress in black,ASOS DESIGN,€30.99,images.asos-media.com/products/asos-design-slash-neck-open-back-skort-dress-in-black/205509972-1-black,asos-design/asos-design-slash-neck-open-back-skort-dress-in-black/prd/205509972#colourWayId-205509973
53,ASOS DESIGN cropped trench coat in olive,ASOS DESIGN,€54.99,images.asos-media.com/products/asos-design-cropped-trench-coat-in-olive/205203560-1-olive,asos-design/asos-design-cropped-trench-coat-in-olive/prd/205203560#colourWayId-205203561
54,Anaya Bridesmaid tulle one shoulder maxi dress in pink,Anaya,€108.75,images.asos-media.com/products/anaya-bridesmaid-tulle-one-shoulder-maxi-dress-in-pink/204532536-1-pink,anaya/anaya-bridesmaid-tulle-one-shoulder-maxi-dress-in-pink/prd/204532536#colourWayId-204532553
55,ASOS DESIGN one sleeve cut out maxi dress in black,ASOS DESIGN,€34.99,images.asos-media.com/products/asos-design-one-sleeve-cut-out-maxi-dress-in-black/205694568-1-black,asos-design/asos-design-one-sleeve-cut-out-maxi-dress-in-black/prd/205694568#colourWayId-205694572
56,ASOS DESIGN baby tee with ribbon bow detail in ivory,ASOS DESIGN,€19.99,images.asos-media.com/products/asos-design-baby-tee-with-ribbon-bow-detail-in-ivory/205700093-1-white,asos-design/asos-design-baby-tee-with-ribbon-bow-detail-in-ivory/prd/205700093#colourWayId-205700094
57,ASOS DESIGN mesh cross over neck long sleeve top in black,ASOS DESIGN,€29.99,images.asos-media.com/products/asos-design-mesh-cross-over-neck-long-sleeve-top-in-black/205749891-1-black,asos-design/asos-design-mesh-cross-over-neck-long-sleeve-top-in-black/prd/205749891#colourWayId-205749892
58,ASOS DESIGN long sleeve square fold over bardot mini dress in black,ASOS DESIGN,€27.99,images.asos-media.com/products/asos-design-long-sleeve-square-fold-over-bardot-mini-dress-in-black/205782485-1-black,asos-design/asos-design-long-sleeve-square-fold-over-bardot-mini-dress-in-black/prd/205782485#colourWayId-205782486
59,ASOS DESIGN high apex maxi slip dress in spun in mono spot,ASOS DESIGN,€34.99,images.asos-media.com/products/asos-design-high-apex-maxi-slip-dress-in-spun-in-mono-spot/205570274-1-monospot,asos-design/asos-design-high-apex-maxi-slip-dress-in-spun-in-mono-spot/prd/205570274#colourWayId-205570275
60,ASOS DESIGN faux leather bandeau top co ord with asymmetric hem in chocolate,ASOS DESIGN,€19.99,images.asos-media.com/products/asos-design-faux-leather-bandeau-top-co-ord-with-asymmetric-hem-in-chocolate/205827946-1-chocolate,asos-design/asos-design-faux-leather-bandeau-top-co-ord-with-asymmetric-hem-in-chocolate/prd/205827946#colourWayId-205827950
61,ASOS DESIGN Sienna lace underwired body with sleeves in black,ASOS DESIGN,€32.99,images.asos-media.com/products/asos-design-sienna-lace-underwired-body-with-sleeves-in-black/204960020-1-black,asos-design/asos-design-sienna-lace-underwired-body-with-sleeves-in-black/prd/204960020#colourWayId-204960023
62,ASOS DESIGN slinky base layer top in brown,ASOS DESIGN,€19.99,images.asos-media.com/products/asos-design-slinky-base-layer-top-in-brown/205866938-1-khaki,asos-design/asos-design-slinky-base-layer-top-in-brown/prd/205866938#colourWayId-205866939
63,ASOS DESIGN tie front exaggerated drape maxi dress in bottle green,ASOS DESIGN,€37.99,images.asos-media.com/products/asos-design-tie-front-exaggerated-drape-maxi-dress-in-bottle-green/205870728-1-green,asos-design/asos-design-tie-front-exaggerated-drape-maxi-dress-in-bottle-green/prd/205870728#colourWayId-205870737
64,South Beach high waist high leg bikini bottom in brown metallic,South Beach,€21.99,images.asos-media.com/products/south-beach-high-waist-high-leg-bikini-bottom-in-brown-metallic/205457628-1-brown,south-beach/south-beach-gold-buckle-bikini-in-brown-metallic/grp/205977759#colourWayId-205457629&productId-205457628
65,South Beach Curve halter swimsuit in brown metallic,South Beach Curve,€49.99,images.asos-media.com/products/south-beach-curve-halter-swimsuit-in-brown-metallic/205457733-1-brown,south-beach-curve/south-beach-curve-halter-swimsuit-in-brown-metallic/prd/205457733#colourWayId-205457753
66,South Beach Curve knot high waist zebra bikini bottom in brown,South Beach Curve,€20.99,images.asos-media.com/products/south-beach-curve-knot-high-waist-zebra-bikini-bottom-in-brown/205457740-1-brown,south-beach-curve/south-beach-curve-zebra-print-bikini-in-brown/grp/205977757#colourWayId-205457754&productId-205457740
67,South Beach ruched mini beach skirt in brown metallic,South Beach,€26.99,images.asos-media.com/products/south-beach-ruched-mini-beach-skirt-in-brown-metallic/205457752-1-brown,south-beach/south-beach-ruched-mini-beach-skirt-in-brown-metallic/prd/205457752#colourWayId-205457755
68,South Beach Curve high waist bikini bottom in brown metallic,South Beach Curve,€23.99,images.asos-media.com/products/south-beach-curve-high-waist-bikini-bottom-in-brown-metallic/205457791-1-brown,south-beach-curve/south-beach-curve-gold-buckle-bikini-in-brown-metallic/grp/205977763#colourWayId-205457802&productId-205457791
69,South Beach Curve bandeau gold buckle bikini top in brown metallic,South Beach Curve,€26.99,images.asos-media.com/products/south-beach-curve-bandeau-gold-buckle-bikini-top-in-brown-metallic/205457809-1-brown,south-beach-curve/south-beach-curve-gold-buckle-bikini-in-brown-metallic/grp/205977763#colourWayId-205457819&productId-205457809
70,South Beach halter swimsuit in brown metallic,South Beach,€49.99,images.asos-media.com/products/south-beach-halter-swimsuit-in-brown-metallic/205457828-1-brown,south-beach/south-beach-halter-swimsuit-in-brown-metallic/prd/205457828#colourWayId-205457850
71,South Beach cut out zebra print swimsuit in brown,South Beach,€46.99,images.asos-media.com/products/south-beach-cut-out-zebra-print-swimsuit-in-brown/205457936-1-brown,south-beach/south-beach-cut-out-zebra-print-swimsuit-in-brown/prd/205457936#colourWayId-205457944
72,South Beach bandeau gold buckle bikini top in brown metallic,South Beach,€26.99,images.asos-media.com/products/south-beach-bandeau-gold-buckle-bikini-top-in-brown-metallic/205457938-1-brown,south-beach/south-beach-gold-buckle-bikini-in-brown-metallic/grp/205977759#colourWayId-205457939&productId-205457938
73,South Beach Curve knot front triangle zebra print bikini top in brown,South Beach Curve,€26.99,images.asos-media.com/products/south-beach-curve-knot-front-triangle-zebra-print-bikini-top-in-brown/205458000-1-brown,south-beach-curve/south-beach-curve-zebra-print-bikini-in-brown/grp/205977757#colourWayId-205458001&productId-205458000
74,ASOS DESIGN lace scoop neck cami slip dress in black with camel lining,ASOS DESIGN,€37.99,images.asos-media.com/products/asos-design-lace-scoop-neck-cami-slip-dress-in-black-with-camel-lining/205910919-1-black,asos-design/asos-design-lace-scoop-neck-cami-slip-dress-in-black-with-camel-lining/prd/205910919#colourWayId-205910929
75,ASOS DESIGN high halter neck midi dress in black,ASOS DESIGN,€34.99,images.asos-media.com/products/asos-design-high-halter-neck-midi-dress-in-black/205913229-1-black,asos-design/asos-design-high-halter-neck-midi-dress-in-black/prd/205913229#colourWayId-205913230
76,South Beach Curve zebra print bikini in brown,South Beach Curve,€47.98,images.asos-media.com/groups/south-beach-curve-zebra-print-bikini-in-brown/205977757-group-1,south-beach-curve/south-beach-curve-zebra-print-bikini-in-brown/grp/205977757
77,South Beach gold buckle bikini in brown metallic,South Beach,€48.98,images.asos-media.com/groups/south-beach-gold-buckle-bikini-in-brown-metallic/205977759-group-1,south-beach/south-beach-gold-buckle-bikini-in-brown-metallic/grp/205977759
78,South Beach Curve gold buckle bikini in brown metallic,South Beach Curve,€50.98,images.asos-media.com/groups/south-beach-curve-gold-buckle-bikini-in-brown-metallic/205977763-group-1,south-beach-curve/south-beach-curve-gold-buckle-bikini-in-brown-metallic/grp/205977763
79,ASOS DESIGN wrap mini tea dress with buttons in cherry print,ASOS DESIGN,€39.99,images.asos-media.com/products/asos-design-wrap-mini-tea-dress-with-buttons-in-cherry-print/205653475-1-cherryprint,asos-design/asos-design-wrap-mini-tea-dress-with-buttons-in-cherry-print/prd/205653475#colourWayId-205653486
80,Threadbare Ski ribbed base layer top and leggings set in black,Threadbare Fitness,€34.99,images.asos-media.com/products/threadbare-ski-ribbed-base-layer-top-and-leggings-set-in-black/205245096-1-black,threadbare-fitness/threadbare-ski-ribbed-base-layer-top-and-leggings-set-in-black/prd/205245096#colourWayId-205245117
81,Threadbare Petite Ski ribbed base layer top and leggings set in black,Threadbare Fitness Petite,€34.99,images.asos-media.com/products/threadbare-petite-ski-ribbed-base-layer-top-and-leggings-set-in-black/205312124-1-black,threadbare-fitness-petite/threadbare-petite-ski-ribbed-base-layer-top-and-leggings-set-in-black/prd/205312124#colourWayId-205312125
82,Pink Honey Contour Cakes - Cupcake Cutie,Pink Honey,€24.99,images.asos-media.com/products/pink-honey-contour-cakes-cupcake-cutie/205750487-1-cupcakecutie,pink-honey/pink-honey-contour-cakes-cupcake-cutie/prd/205750487#colourWayId-205750489
